{
  "damage": [
    1.0,
    1.0,
    3.0
  ],
  "description": {
    "ar": "الهجوم الثالث من مجموعة هجمات يستدعي صاعقة.",
    "de": "Der dritte Angriff in einer Kombo beschwört einen Blitzschlag herauf.",
    "en": "The third attack in a combo summons a lightning strike.",
    "es": "Invoca un relámpago con el tercer ataque de un combo.",
    "fr": "La troisième attaque d'un combo invoque la foudre.",
    "fr-CA": "La troisième attaque d'un combo invoque la foudre.",
    "it": "Il terzo attacco di una combo evoca un fulmine.",
    "ja": "コンボ3段目が雷を落とす。",
    "ko": "콤보의 세 번째 공격이 번개를 내려칩니다.",
    "nl": "De derde aanval in een combo roept een blikseminslag op.",
    "pt-BR": "O terceiro ataque em um combo gera um raio.",
    "ru": "Оружие, которое вызывает удар молнии при третьем последовательном ударе.",
    "tr": "Kombonun üçüncü saldırısı bir yıldırım tetikler.",
    "zh-CN": "连击时的第三击召唤一道闪电。",
    "zh-TW": "第三次連擊召喚一道雷擊。"
  },
  "descriptionPlain": {
    "ar": "الهجوم الثالث من مجموعة هجمات يستدعي صاعقة.",
    "de": "Der dritte Angriff in einer Kombo beschwört einen Blitzschlag herauf.",
    "en": "The third attack in a combo summons a lightning strike.",
    "es": "Invoca un relámpago con el tercer ataque de un combo.",
    "fr": "La troisième attaque d'un combo invoque la foudre.",
    "fr-CA": "La troisième attaque d'un combo invoque la foudre.",
    "it": "Il terzo attacco di una combo evoca un fulmine.",
    "ja": "コンボ3段目が雷を落とす。",
    "ko": "콤보의 세 번째 공격이 번개를 내려칩니다.",
    "nl": "De derde aanval in een combo roept een blikseminslag op.",
    "pt-BR": "O terceiro ataque em um combo gera um raio.",
    "ru": "Оружие, которое вызывает удар молнии при третьем последовательном ударе.",
    "tr": "Kombonun üçüncü saldırısı bir yıldırım tetikler.",
    "zh-CN": "连击时的第三击召唤一道闪电。",
    "zh-TW": "第三次連擊召喚一道雷擊。"
  },
  "family": "Gauntlet",
  "heavyDamage": 0.0,
  "icon": "icons/weapons/Gauntlet_Legendary.png",
  "id": "Gauntlet_Legendary",
  "legendary": true,
  "lore": {
    "ar": "قفازان أسطوريان يفحمان عدوك.",
    "de": "Die Panzerhandschuhe der legendären Blasphemie.",
    "en": "The gauntlets of legendary blasphemy.",
    "es": "El guantelete de la blasfemia ancestral.",
    "fr": "Les gantelets du blasphème légendaire.",
    "fr-CA": "Les gantelets du blasphème légendaire.",
    "it": "I guanti della leggendaria blasfemia.",
    "ja": "神を冒涜したとされる伝説の篭手。",
    "ko": "전설적인 모독의 장갑.",
    "nl": "Handschoenen voor legendarische godslastering.",
    "pt-BR": "As manoplas da blasfêmia lendária.",
    "ru": "Перчатки из легенды о богохульстве.",
    "tr": "Efsanevi şirkin eldivenleri.",
    "zh-CN": "传奇亵渎拳套。",
    "zh-TW": "傳奇褻瀆拳套。"
  },
  "name": {
    "ar": "المزدري",
    "de": "Beschmutzer des Göttlichen",
    "en": "Defiler of the Divine",
    "es": "Profanador de la divinidad",
    "fr": "Profanateurs du divin",
    "fr-CA": "Profanateurs du divin",
    "it": "Profanazione del divino",
    "ja": "神々を穢す者",
    "ko": "신성의 모독자",
    "nl": "Ontheiliger van het goddelijke",
    "pt-BR": "Violador da Divindade",
    "ru": "Осквернители божественного",
    "tr": "Kutsalların Kovucusu",
    "zh-CN": "渎圣者",
    "zh-TW": "神聖玷汙者"
  },
  "namePlain": {
    "ar": "المزدري",
    "de": "Beschmutzer des Göttlichen",
    "en": "Defiler of the Divine",
    "es": "Profanador de la divinidad",
    "fr": "Profanateurs du divin",
    "fr-CA": "Profanateurs du divin",
    "it": "Profanazione del divino",
    "ja": "神々を穢す者",
    "ko": "신성의 모독자",
    "nl": "Ontheiliger van het goddelijke",
    "pt-BR": "Violador da Divindade",
    "ru": "Осквернители божественного",
    "tr": "Kutsalların Kovucusu",
    "zh-CN": "渎圣者",
    "zh-TW": "神聖玷汙者"
  },
  "speed": 0.8,
  "thumb": "icons/weapons/64/Gauntlet_Legendary.png"
}
