{
  "damage": [
    2.0,
    2.0,
    2.0
  ],
  "description": {
    "ar": "يلحق ضررًا أكبر بكثير من ضرر أسلحة الفانين.",
    "de": "Teilt erheblich mehr Schaden als gewöhnliche Waffen aus.",
    "en": "Deal significantly more damage than mortal weapons.",
    "es": "Inflige más daño que las armas mortales.",
    "fr": "Inflige nettement plus de dégâts que les armes ordinaires.",
    "fr-CA": "Inflige beaucoup plus de dégâts que les armes ordinaires.",
    "it": "Infligge danni significativamente maggiori rispetto alle armi mortali.",
    "ja": "通常の武器よりも強大な破壊力を誇る。",
    "ko": "필멸의 무기보다 훨씬 더 많은 피해를 입힙니다.",
    "nl": "Breng aanzienlijk meer schade toe dan met stervelingwapens.",
    "pt-BR": "Armas Celestiais causam dano consideravelmente maior que as armas de mortais.",
    "ru": "Оружие, которое наносит гораздо больше урона, чем обычное.",
    "tr": "Fâni silahlara kıyasla çok daha fazla hasar verir.",
    "zh-CN": "造成远胜凡间武器的伤害。",
    "zh-TW": "造成遠勝凡間武器的傷害。"
  },
  "descriptionPlain": {
    "ar": "يلحق ضررًا أكبر بكثير من ضرر أسلحة الفانين.",
    "de": "Teilt erheblich mehr Schaden als gewöhnliche Waffen aus.",
    "en": "Deal significantly more damage than mortal weapons.",
    "es": "Inflige más daño que las armas mortales.",
    "fr": "Inflige nettement plus de dégâts que les armes ordinaires.",
    "fr-CA": "Inflige beaucoup plus de dégâts que les armes ordinaires.",
    "it": "Infligge danni significativamente maggiori rispetto alle armi mortali.",
    "ja": "通常の武器よりも強大な破壊力を誇る。",
    "ko": "필멸의 무기보다 훨씬 더 많은 피해를 입힙니다.",
    "nl": "Breng aanzienlijk meer schade toe dan met stervelingwapens.",
    "pt-BR": "Armas Celestiais causam dano consideravelmente maior que as armas de mortais.",
    "ru": "Оружие, которое наносит гораздо больше урона, чем обычное.",
    "tr": "Fâni silahlara kıyasla çok daha fazla hasar verir.",
    "zh-CN": "造成远胜凡间武器的伤害。",
    "zh-TW": "造成遠勝凡間武器的傷害。"
  },
  "family": "Sword",
  "heavyDamage": 0.0,
  "icon": "icons/weapons/Sword_Godly.png",
  "id": "Sword_Godly",
  "legendary": false,
  "lore": {
    "ar": "كان يُستخدم لإراقة دماء السادة...",
    "de": "Wurde einst dazu verwendet, einen Gott zu verwunden …",
    "en": "Once used to draw Godly blood...",
    "es": "Otrora usada para derramar sangre divina...",
    "fr": "Autrefois utilisée pour faire couler le sang des dieux...",
    "fr-CA": "Autrefois utilisée pour faire couler le sang des dieux...",
    "it": "Un tempo utilizzata per spillare sangue divino...",
    "ja": "かつては神に血を流させるために使われていたという…",
    "ko": "신의 피를 흘리기 위해 사용되었던 것이다...",
    "nl": "Ooit gebruikt om goddelijk bloed te laten vloeien...",
    "pt-BR": "Já foi usada para derramar sangue Celestial...",
    "ru": "Когда-то это лезвие обагрила кровь бога.",
    "tr": "Bir zamanlar Tanrıların kanını dökmek için kullanılıyordu...",
    "zh-CN": "曾用来弑神之血……",
    "zh-TW": "曾用來使神見血……"
  },
  "name": {
    "ar": "سيف السادة",
    "de": "Göttliches Schwert",
    "en": "Godly Sword",
    "es": "Espada divina",
    "fr": "Épée divine",
    "fr-CA": "Épée divine",
    "it": "Spada divina",
    "ja": "神なる剣",
    "ko": "신성한 검",
    "nl": "Goddelijke zwaard",
    "pt-BR": "Espada Celestial",
    "ru": "Священный меч",
    "tr": "Tanrıların Kılıcı",
    "zh-CN": "神力之剑",
    "zh-TW": "神力之劍"
  },
  "namePlain": {
    "ar": "سيف السادة",
    "de": "Göttliches Schwert",
    "en": "Godly Sword",
    "es": "Espada divina",
    "fr": "Épée divine",
    "fr-CA": "Épée divine",
    "it": "Spada divina",
    "ja": "神なる剣",
    "ko": "신성한 검",
    "nl": "Goddelijke zwaard",
    "pt-BR": "Espada Celestial",
    "ru": "Священный меч",
    "tr": "Tanrıların Kılıcı",
    "zh-CN": "神力之剑",
    "zh-TW": "神力之劍"
  },
  "speed": 1.0,
  "thumb": "icons/weapons/64/Sword_Godly.png"
}
