{
  "damage": [
    2.7
  ],
  "description": {
    "ar": "تتيح فرصة لعلاج حاملها باستخدام قوة الحياة لعدو مقتول.",
    "de": "Gewährt die Chance, den Träger mit der Lebenskraft eines getöteten Gegners zu heilen.",
    "en": "Chance to heal the wielder using the life force of a slain foe.",
    "es": "Probabilidad de curar al portador absorbiendo la fuerza vital de un enemigo asesinado.",
    "fr": "Vous soigne parfois lorsque vous tuez un ennemi.",
    "fr-CA": "Vous soigne parfois lorsque vous tuez un ennemi.",
    "it": "Ha la possibilità di curare chi lo impugna, con la forza vitale dei nemici debellati.",
    "ja": "一定確率で倒した敵の生命力を吸い取り、使用者の体力を回復する。",
    "ko": "죽은 적들의 생명력으로 착용자를 일정 확률로 회복시킵니다.",
    "nl": "Kans om de gebruiker te genezen met de levenskracht van een verslagen vijand.",
    "pt-BR": "Chance de curar seu portador com a força vital de um inimigo morto.",
    "ru": "Оружие, которое иногда передаёт владельцу жизненную силу врага.",
    "tr": "Katledilen bir düşmanın yaşam enerjisini kullanarak seni iyileştirme ihtimali vardır.",
    "zh-CN": "有一定机率能运用死去敌人的生命力，治疗武器使用者。",
    "zh-TW": "有一定機率能運用死去敵人的生命力，治療武器使用者。"
  },
  "descriptionPlain": {
    "ar": "تتيح فرصة لعلاج حاملها باستخدام قوة الحياة لعدو مقتول.",
    "de": "Gewährt die Chance, den Träger mit der Lebenskraft eines getöteten Gegners zu heilen.",
    "en": "Chance to heal the wielder using the life force of a slain foe.",
    "es": "Probabilidad de curar al portador absorbiendo la fuerza vital de un enemigo asesinado.",
    "fr": "Vous soigne parfois lorsque vous tuez un ennemi.",
    "fr-CA": "Vous soigne parfois lorsque vous tuez un ennemi.",
    "it": "Ha la possibilità di curare chi lo impugna, con la forza vitale dei nemici debellati.",
    "ja": "一定確率で倒した敵の生命力を吸い取り、使用者の体力を回復する。",
    "ko": "죽은 적들의 생명력으로 착용자를 일정 확률로 회복시킵니다.",
    "nl": "Kans om de gebruiker te genezen met de levenskracht van een verslagen vijand.",
    "pt-BR": "Chance de curar seu portador com a força vital de um inimigo morto.",
    "ru": "Оружие, которое иногда передаёт владельцу жизненную силу врага.",
    "tr": "Katledilen bir düşmanın yaşam enerjisini kullanarak seni iyileştirme ihtimali vardır.",
    "zh-CN": "有一定机率能运用死去敌人的生命力，治疗武器使用者。",
    "zh-TW": "有一定機率能運用死去敵人的生命力，治療武器使用者。"
  },
  "family": "Blunderbuss",
  "heavyDamage": 0.0,
  "icon": "icons/weapons/Blunderbuss_Healing.png",
  "id": "Blunderbuss_Healing",
  "legendary": false,
  "lore": {
    "ar": "استدعاء حياة للاستحواذ عليها.",
    "de": "Hol dir ein Leben, um es zu verzehren.",
    "en": "Fetch a life to be consumed.",
    "es": "Rastrea una vida que consumir.",
    "fr": "Une vie perdue contre une vie sauvée.",
    "fr-CA": "Une vie perdue contre une vie sauvée.",
    "it": "Scegli una vita da consumare.",
    "ja": "獲物でしかない命を吸い取れ。",
    "ko": "생명력을 빼앗아 흡수한다.",
    "nl": "Pik een leven in voor consumptie.",
    "pt-BR": "Capture uma alma para consumir.",
    "ru": "Чужая жизнь — ваша.",
    "tr": "Tükenmeyi bekleyen hayatların eceli.",
    "zh-CN": "夺取生命并加以吞噬。",
    "zh-TW": "奪取生命並加以吞噬。"
  },
  "name": {
    "ar": "بندقية مصاص الدماء القصيرة",
    "de": "Vampir-Donnerbüchse",
    "en": "Vampiric Blunderbuss",
    "es": "Trabuco vampírico",
    "fr": "Tromblon vampirique",
    "fr-CA": "Tromblon vampirique",
    "it": "Schioppo vampiresco",
    "ja": "吸血の銃",
    "ko": "흡혈 나팔총",
    "nl": "Vampierdonderbus",
    "pt-BR": "Bacamarte Vampírico",
    "ru": "Вампирический мушкетон",
    "tr": "Cani Alaybozan",
    "zh-CN": "吸血之枪",
    "zh-TW": "吸血之槍"
  },
  "namePlain": {
    "ar": "بندقية مصاص الدماء القصيرة",
    "de": "Vampir-Donnerbüchse",
    "en": "Vampiric Blunderbuss",
    "es": "Trabuco vampírico",
    "fr": "Tromblon vampirique",
    "fr-CA": "Tromblon vampirique",
    "it": "Schioppo vampiresco",
    "ja": "吸血の銃",
    "ko": "흡혈 나팔총",
    "nl": "Vampierdonderbus",
    "pt-BR": "Bacamarte Vampírico",
    "ru": "Вампирический мушкетон",
    "tr": "Cani Alaybozan",
    "zh-CN": "吸血之枪",
    "zh-TW": "吸血之槍"
  },
  "speed": 1.0,
  "thumb": "icons/weapons/64/Blunderbuss_Healing.png"
}
