{
  "damage": [
    2.7
  ],
  "description": {
    "ar": "تطلق 3 قذائف دفعة واحدة.",
    "de": "Verschießt drei Projektile mit einem Schuss.",
    "en": "Shoots 3 projectiles in one shot.",
    "es": "Arroja 3 proyectiles de un solo disparo.",
    "fr": "Tire trois projectiles à chaque coup.",
    "fr-CA": "Tire trois projectiles à chaque coup.",
    "it": "Spara 3 proiettili in un colpo solo.",
    "ja": "一度の射撃で弾を3発射出する。",
    "ko": "한 번에 탄환 3개를 발사합니다.",
    "nl": "Schiet 3 projectielen in één keer.",
    "pt-BR": "Dispare 3 projéteis de uma vez.",
    "ru": "Оружие, которое выпускает по 3 пули.",
    "tr": "Tek saldırıda 3 mermi ateşler.",
    "zh-CN": "一枪可射出 3 个投射物。",
    "zh-TW": "一槍射出 3 個投射物。"
  },
  "descriptionPlain": {
    "ar": "تطلق 3 قذائف دفعة واحدة.",
    "de": "Verschießt drei Projektile mit einem Schuss.",
    "en": "Shoots 3 projectiles in one shot.",
    "es": "Arroja 3 proyectiles de un solo disparo.",
    "fr": "Tire trois projectiles à chaque coup.",
    "fr-CA": "Tire trois projectiles à chaque coup.",
    "it": "Spara 3 proiettili in un colpo solo.",
    "ja": "一度の射撃で弾を3発射出する。",
    "ko": "한 번에 탄환 3개를 발사합니다.",
    "nl": "Schiet 3 projectielen in één keer.",
    "pt-BR": "Dispare 3 projéteis de uma vez.",
    "ru": "Оружие, которое выпускает по 3 пули.",
    "tr": "Tek saldırıda 3 mermi ateşler.",
    "zh-CN": "一枪可射出 3 个投射物。",
    "zh-TW": "一槍射出 3 個投射物。"
  },
  "family": "Blunderbuss",
  "heavyDamage": 0.0,
  "icon": "icons/weapons/Blunderbuss_Legendary.png",
  "id": "Blunderbuss_Legendary",
  "legendary": true,
  "lore": {
    "ar": "بندقية قصيرة أسطورية تكتسح هدفها.",
    "de": "Die Donnerbüchse der legendären Gier.",
    "en": "The blunderbuss of legendary greed.",
    "es": "El trabuco de la avaricia ancestral.",
    "fr": "Le tromblon de la cupidité légendaire.",
    "fr-CA": "Le tromblon de la cupidité légendaire.",
    "it": "Lo schioppo della leggendaria avidità.",
    "ja": "底なしの欲にまみれた伝説の銃。",
    "ko": "전설적인 탐욕의 나팔총.",
    "nl": "Een donderbus van legendarische hebzucht.",
    "pt-BR": "O bacamarte da ganância lendária.",
    "ru": "Мушкетон из легенды о жадности.",
    "tr": "Efsanevi cimriliğin alaybozanı.",
    "zh-CN": "传奇贪婪之枪。",
    "zh-TW": "傳奇貪婪之槍。"
  },
  "name": {
    "ar": "مصير بليمبو الأول",
    "de": "Schicksal von Plimbo dem Ersten",
    "en": "Fate of Plimbo the First",
    "es": "Hado de Plimbo el Primigenio",
    "fr": "Destin de Plimbo Ier",
    "fr-CA": "Destin de Plimbo Ier",
    "it": "Sorte di Plimbo il Vecchio",
    "ja": "プリンボ1世の宿命",
    "ko": "첫째 플림보의 운명",
    "nl": "Lot van Plimbo de eerste",
    "pt-BR": "Sina de Plimbo, o Primeiro",
    "ru": "Участь Плимбо Первого",
    "tr": "İlk Plimbo'nun Kaderi",
    "zh-CN": "普霖波一世之命运",
    "zh-TW": "普霖波一世之命"
  },
  "namePlain": {
    "ar": "مصير بليمبو الأول",
    "de": "Schicksal von Plimbo dem Ersten",
    "en": "Fate of Plimbo the First",
    "es": "Hado de Plimbo el Primigenio",
    "fr": "Destin de Plimbo Ier",
    "fr-CA": "Destin de Plimbo Ier",
    "it": "Sorte di Plimbo il Vecchio",
    "ja": "プリンボ1世の宿命",
    "ko": "첫째 플림보의 운명",
    "nl": "Lot van Plimbo de eerste",
    "pt-BR": "Sina de Plimbo, o Primeiro",
    "ru": "Участь Плимбо Первого",
    "tr": "İlk Plimbo'nun Kaderi",
    "zh-CN": "普霖波一世之命运",
    "zh-TW": "普霖波一世之命"
  },
  "speed": 1.0,
  "thumb": "icons/weapons/64/Blunderbuss_Legendary.png"
}
