{
  "damage": [
    1.0,
    1.0,
    1.0
  ],
  "description": {
    "ar": "نصل متزن يلحق ضررًا متوسطًا.",
    "de": "Eine gut ausbalancierte Klinge, die moderaten Schaden verursacht.",
    "en": "A well balanced blade dealing moderate damage.",
    "es": "Una espada bien equilibrada que inflige bastante daño.",
    "fr": "Une épée équilibrée qui inflige des dégâts modérés.",
    "fr-CA": "Une épée équilibrée qui inflige des dégâts modérés.",
    "it": "Una lama ben bilanciata che infligge danni moderati.",
    "ja": "バランスの取れた扱いやすい剣。",
    "ko": "적당한 피해를 주는 균형잡힌 칼입니다.",
    "nl": "Een zwaard met een goede balans voor gemiddelde schade.",
    "pt-BR": "Uma lâmina bem equilibrada que causa dano moderado.",
    "ru": "Клинок с хорошим балансом.",
    "tr": "Ortalama hasar veren, dengeli bir kılıç.",
    "zh-CN": "功能平衡的刀刃，造成中量伤害。",
    "zh-TW": "功能平衡的刀刃，造成中量傷害。"
  },
  "descriptionPlain": {
    "ar": "نصل متزن يلحق ضررًا متوسطًا.",
    "de": "Eine gut ausbalancierte Klinge, die moderaten Schaden verursacht.",
    "en": "A well balanced blade dealing moderate damage.",
    "es": "Una espada bien equilibrada que inflige bastante daño.",
    "fr": "Une épée équilibrée qui inflige des dégâts modérés.",
    "fr-CA": "Une épée équilibrée qui inflige des dégâts modérés.",
    "it": "Una lama ben bilanciata che infligge danni moderati.",
    "ja": "バランスの取れた扱いやすい剣。",
    "ko": "적당한 피해를 주는 균형잡힌 칼입니다.",
    "nl": "Een zwaard met een goede balans voor gemiddelde schade.",
    "pt-BR": "Uma lâmina bem equilibrada que causa dano moderado.",
    "ru": "Клинок с хорошим балансом.",
    "tr": "Ortalama hasar veren, dengeli bir kılıç.",
    "zh-CN": "功能平衡的刀刃，造成中量伤害。",
    "zh-TW": "功能平衡的刀刃，造成中量傷害。"
  },
  "family": "Sword",
  "heavyDamage": 0.0,
  "icon": "icons/weapons/Sword.png",
  "id": "Sword",
  "legendary": false,
  "lore": {
    "ar": "الرفيق القوي للمحارب المتجول.",
    "de": "Ein treuer Begleiter des wandernden Kriegers.",
    "en": "Stalwart companion to the wandering warrior.",
    "es": "Leal acompañante de los guerreros errantes.",
    "fr": "Fidèle compagnon des guerriers vagabonds.",
    "fr-CA": "Fidèle compagnon des guerriers vagabonds.",
    "it": "Compagna fedele del guerriero errante.",
    "ja": "彷徨う戦士にとっては頼れる相棒だ。",
    "ko": "방랑하는 전사에게 있어 든든한 동반자이다.",
    "nl": "Loyale metgezel voor de zwervende krijger.",
    "pt-BR": "Fiel escudeiro para o guerreiro errante.",
    "ru": "Верный товарищ многих странствующих воинов.",
    "tr": "Macerasever savaşçıların güvenilir yoldaşı.",
    "zh-CN": "流浪战士的忠实伙伴。",
    "zh-TW": "流浪戰士的忠實夥伴。"
  },
  "name": {
    "ar": "نصل المحارب",
    "de": "Klinge des Kreuzfahrers",
    "en": "Crusader's Blade",
    "es": "Espada de misionero",
    "fr": "Lame des croisades",
    "fr-CA": "Lame des croisades",
    "it": "Spada del crociato",
    "ja": "聖戦士の剣",
    "ko": "성기사의 검",
    "nl": "Kruisvaarderszwaard",
    "pt-BR": "Lâmina do Cavaleiro",
    "ru": "Меч завоевателей",
    "tr": "Seferber Kılıcı",
    "zh-CN": "圣战士之刃",
    "zh-TW": "聖戰士之刃"
  },
  "namePlain": {
    "ar": "نصل المحارب",
    "de": "Klinge des Kreuzfahrers",
    "en": "Crusader's Blade",
    "es": "Espada de misionero",
    "fr": "Lame des croisades",
    "fr-CA": "Lame des croisades",
    "it": "Spada del crociato",
    "ja": "聖戦士の剣",
    "ko": "성기사의 검",
    "nl": "Kruisvaarderszwaard",
    "pt-BR": "Lâmina do Cavaleiro",
    "ru": "Меч завоевателей",
    "tr": "Seferber Kılıcı",
    "zh-CN": "圣战士之刃",
    "zh-TW": "聖戰士之刃"
  },
  "speed": 1.0,
  "thumb": "icons/weapons/64/Sword.png"
}
