{
  "damage": [
    1.0,
    1.0,
    3.0
  ],
  "description": {
    "ar": "الحماس <sprite name=\"icon_blackSoul\"> الذي جمعته سيزيد أيضًا شريط الإلهام المقدر لديك.",
    "de": "Gesammelter Eifer <sprite name=\"icon_blackSoul\"> vergrößert auch deine Göttliche-Inspiration-Leiste.",
    "en": "Collected Fervour <sprite name=\"icon_blackSoul\"> will also increase your Divine Inspiration bar.",
    "es": "El fervor que recojas <sprite name=\"icon_blackSoul\"> también aumentará tu barra de inspiración divina.",
    "fr": "Vous permettent d'utiliser la ferveur collectée <sprite name=\"icon_blackSoul\"> pour augmenter votre barre d'inspiration divine.",
    "fr-CA": "Vous permettent d'utiliser la ferveur collectée <sprite name=\"icon_blackSoul\"> pour augmenter votre barre d'inspiration divine.",
    "it": "Il Fervore <sprite name=\"icon_blackSoul\"> raccolto aumenterà anche la tua barra Ispirazione divina.",
    "ja": "信力 <sprite name=\"icon_blackSoul\"> を獲得すると神聖なる啓示バーが増加する。",
    "ko": "획득한 열정 <sprite name=\"icon_blackSoul\">은 또한 종교적 영감 게이지를 증가시킵니다.",
    "nl": "Verzamelde furie <sprite name=\"icon_blackSoul\"> vult ook je goddelijke inspiratie-balk.",
    "pt-BR": "O Fervor <sprite name=\"icon_blackSoul\"> coletado também aumentará a sua barra de Inspiração Divina.",
    "ru": "Оружие, которое пополняет шкалу откровения при накоплении усердия <sprite name=\"icon_blackSoul\">.",
    "tr": "Toplanan Şevk <sprite name=\"icon_blackSoul\"> aynı zamanda İlahi İlham göstergesini de doldurur.",
    "zh-CN": "你收集到的热诚 <sprite name=\"icon_blackSoul\"> 将填充圣冠灵感条。",
    "zh-TW": "你收集到的熱誠 <sprite name=\"icon_blackSoul\"> 將填充聖冠靈感條。"
  },
  "descriptionPlain": {
    "ar": "الحماس الذي جمعته سيزيد أيضًا شريط الإلهام المقدر لديك.",
    "de": "Gesammelter Eifer vergrößert auch deine Göttliche-Inspiration-Leiste.",
    "en": "Collected Fervour will also increase your Divine Inspiration bar.",
    "es": "El fervor que recojas también aumentará tu barra de inspiración divina.",
    "fr": "Vous permettent d'utiliser la ferveur collectée pour augmenter votre barre d'inspiration divine.",
    "fr-CA": "Vous permettent d'utiliser la ferveur collectée pour augmenter votre barre d'inspiration divine.",
    "it": "Il Fervore raccolto aumenterà anche la tua barra Ispirazione divina.",
    "ja": "信力 を獲得すると神聖なる啓示バーが増加する。",
    "ko": "획득한 열정 은 또한 종교적 영감 게이지를 증가시킵니다.",
    "nl": "Verzamelde furie vult ook je goddelijke inspiratie-balk.",
    "pt-BR": "O Fervor coletado também aumentará a sua barra de Inspiração Divina.",
    "ru": "Оружие, которое пополняет шкалу откровения при накоплении усердия.",
    "tr": "Toplanan Şevk aynı zamanda İlahi İlham göstergesini de doldurur.",
    "zh-CN": "你收集到的热诚 将填充圣冠灵感条。",
    "zh-TW": "你收集到的熱誠 將填充聖冠靈感條。"
  },
  "family": "Gauntlet",
  "heavyDamage": 0.0,
  "icon": "icons/weapons/Gauntlet_Fervour.png",
  "id": "Gauntlet_Fervour",
  "legendary": false,
  "lore": {
    "ar": "يحميان من الشك.",
    "de": "Schützt vor Zweifeln.",
    "en": "Protects against doubt.",
    "es": "Protege de la duda.",
    "fr": "Vous protège du doute.",
    "fr-CA": "Vous protège du doute.",
    "it": "Non dubiterai mai dei tuoi ideali.",
    "ja": "疑心に対する加護を与えてくれる。",
    "ko": "의심을 떨쳐버릴 수 있다.",
    "nl": "Beschermt tegen twijfel.",
    "pt-BR": "Protege contra a dúvida.",
    "ru": "Разят без сомнения.",
    "tr": "Şüpheye yer yok.",
    "zh-CN": "防止产生疑虑。",
    "zh-TW": "抵禦疑慮。"
  },
  "name": {
    "ar": "قفازا الإقدام",
    "de": "Eifer-Panzerhandschuh",
    "en": "Zealous Gauntlet",
    "es": "Guantelete ferviente",
    "fr": "Gant occulte",
    "fr-CA": "Gant fervent",
    "it": "Guanti ferventi",
    "ja": "篤信なる篭手",
    "ko": "열성의 건틀릿",
    "nl": "Onverstoorbare handschoenen",
    "pt-BR": "Manopla Zelosa",
    "ru": "Неистовые перчатки",
    "tr": "Hırs Eldiveni",
    "zh-CN": "狂热拳套",
    "zh-TW": "狂熱拳套"
  },
  "namePlain": {
    "ar": "قفازا الإقدام",
    "de": "Eifer-Panzerhandschuh",
    "en": "Zealous Gauntlet",
    "es": "Guantelete ferviente",
    "fr": "Gant occulte",
    "fr-CA": "Gant fervent",
    "it": "Guanti ferventi",
    "ja": "篤信なる篭手",
    "ko": "열성의 건틀릿",
    "nl": "Onverstoorbare handschoenen",
    "pt-BR": "Manopla Zelosa",
    "ru": "Неистовые перчатки",
    "tr": "Hırs Eldiveni",
    "zh-CN": "狂热拳套",
    "zh-TW": "狂熱拳套"
  },
  "speed": 0.8,
  "thumb": "icons/weapons/64/Gauntlet_Fervour.png"
}
