{
  "damage": [
    2.0,
    2.0,
    2.0
  ],
  "description": {
    "ar": "تتيح فرصة لتسميم الأعداء عند الهجوم.",
    "de": "Gewährt die Chance, angegriffene Gegner zu vergiften.",
    "en": "Chance of poisoning enemies when attacking.",
    "es": "Probabilidad de envenenar a los enemigos al atacar.",
    "fr": "Empoisonne parfois les ennemis que vous attaquez.",
    "fr-CA": "Empoisonne parfois les ennemis que vous attaquez.",
    "it": "Ha la possibilità di avvelenare i nemici che attacchi.",
    "ja": "攻撃時、一定確率で毒を付与する。",
    "ko": "공격을 할 때 일정 확률로 적들을 중독시킵니다.",
    "nl": "Kans op vergiftigen van vijanden bij aanvallen.",
    "pt-BR": "Chance de envenenar inimigos ao atacá-los.",
    "ru": "Оружие, которое отравляет врагов.",
    "tr": "Düşmanları zehirleme ihtimali vardır.",
    "zh-CN": "攻击时有一定机率使敌人中毒。",
    "zh-TW": "攻擊時有一定機率使敵人中毒。"
  },
  "descriptionPlain": {
    "ar": "تتيح فرصة لتسميم الأعداء عند الهجوم.",
    "de": "Gewährt die Chance, angegriffene Gegner zu vergiften.",
    "en": "Chance of poisoning enemies when attacking.",
    "es": "Probabilidad de envenenar a los enemigos al atacar.",
    "fr": "Empoisonne parfois les ennemis que vous attaquez.",
    "fr-CA": "Empoisonne parfois les ennemis que vous attaquez.",
    "it": "Ha la possibilità di avvelenare i nemici che attacchi.",
    "ja": "攻撃時、一定確率で毒を付与する。",
    "ko": "공격을 할 때 일정 확률로 적들을 중독시킵니다.",
    "nl": "Kans op vergiftigen van vijanden bij aanvallen.",
    "pt-BR": "Chance de envenenar inimigos ao atacá-los.",
    "ru": "Оружие, которое отравляет врагов.",
    "tr": "Düşmanları zehirleme ihtimali vardır.",
    "zh-CN": "攻击时有一定机率使敌人中毒。",
    "zh-TW": "攻擊時有一定機率使敵人中毒。"
  },
  "family": "Axe",
  "heavyDamage": 0.0,
  "icon": "icons/weapons/Axe_Poison.png",
  "id": "Axe_Poison",
  "legendary": false,
  "lore": {
    "ar": "يتوسل المسموم لإنهاء معاناته بالنصل.",
    "de": "Einmal vom Gift getroffen, wird man süchtig nach der Klinge.",
    "en": "Once struck by the toxins, one begs for the blade.",
    "es": "Cuando las toxinas te infectan, solo desearás la muerte.",
    "fr": "Vos ennemis vous supplieront de les achever.",
    "fr-CA": "Vos ennemis vous supplieront de les achever.",
    "it": "Una volta esposti alle tossine, si implora la lama.",
    "ja": "毒をその身に受けた者は、死による救済を請うことだろう。",
    "ko": "독에 명중당한 적은 죽음을 구걸하게 될 것이다.",
    "nl": "Zodra het gif door de aderen stroomt, zullen ze smeken om de genadeklap.",
    "pt-BR": "Quando atingido pelas toxinas, vai implorar pela lâmina.",
    "ru": "Яд страшнее любого клинка.",
    "tr": "Zehri kapan baltayı mumla arar.",
    "zh-CN": "中了毒素的伤者将乞求一击致命，得以解脱。",
    "zh-TW": "中了毒素的傷者將乞求一擊致命好得以解脫。"
  },
  "name": {
    "ar": "فأس الهلاك",
    "de": "Tückische Axt",
    "en": "Bane Axe",
    "es": "Hacha de la perdición",
    "fr": "Hache maudite",
    "fr-CA": "Hache maudite",
    "it": "Ascia velenosa",
    "ja": "有毒なる斧",
    "ko": "파멸의 도끼",
    "nl": "Venijnbijl",
    "pt-BR": "Machado Peçonhento",
    "ru": "Истощающий топор",
    "tr": "Zehirli Balta",
    "zh-CN": "恶毒之斧",
    "zh-TW": "惡毒之斧"
  },
  "namePlain": {
    "ar": "فأس الهلاك",
    "de": "Tückische Axt",
    "en": "Bane Axe",
    "es": "Hacha de la perdición",
    "fr": "Hache maudite",
    "fr-CA": "Hache maudite",
    "it": "Ascia velenosa",
    "ja": "有毒なる斧",
    "ko": "파멸의 도끼",
    "nl": "Venijnbijl",
    "pt-BR": "Machado Peçonhento",
    "ru": "Истощающий топор",
    "tr": "Zehirli Balta",
    "zh-CN": "恶毒之斧",
    "zh-TW": "惡毒之斧"
  },
  "speed": 0.5,
  "thumb": "icons/weapons/64/Axe_Poison.png"
}
